{
  "schemaVersion": "1.0",
  "workflowId": "top-skill-2-driver-dogfood",
  "runId": "2026-05-14-driver-exit-status-dogfood",
  "currentState": "not-certified",
  "derivedAt": "2026-05-14T19:14:49Z",
  "derivedBy": "scripts/update_orchestration_state.py",
  "stateEvidence": [
    {
      "checkId": "runner-report",
      "status": "pass",
      "details": [
        "runnerStatus=pass"
      ]
    },
    {
      "checkId": "pass-execution",
      "status": "pass",
      "details": [
        "Pass results or completed handoffs found."
      ]
    },
    {
      "checkId": "judicial-handoff",
      "status": "pass",
      "details": [
        "Judicial handoff is valid."
      ]
    },
    {
      "checkId": "delivery-certification",
      "status": "not_verified",
      "details": [
        "deliveryStatus=not-certified"
      ]
    },
    {
      "checkId": "certification-snapshot",
      "status": "pass",
      "details": [
        "Certification snapshot matches checked artifacts."
      ]
    }
  ],
  "artifactRefs": {
    "runnerWorkflow": "runner/runner-workflow.json",
    "runnerReport": "runner/runner-report.json",
    "judicialHandoff": "handoffs/judicial.handoff.json",
    "deliveryCertification": "reports/delivery-certification.json",
    "certificationSnapshot": "reports/certification-snapshot.json"
  },
  "limitations": [
    "Run has certification output but does not satisfy delivery complete gates."
  ],
  "previousState": "not-certified",
  "allowedNextStates": [
    "passes-executed",
    "runner-verified",
    "judicial-validated",
    "certified",
    "failed"
  ]
}
